{"$id":"https://moving-origin-research.invalid/schemas/m4-model-preflight-request-v1","$schema":"https://json-schema.org/draft/2020-12/schema","additionalProperties":false,"properties":{"co_residency":{"type":"object"},"context_lengths":{"const":[1024,4096,8192]},"date":{"const":"2026-08-21"},"ladder_manifest_sha256":{"pattern":"^[0-9a-f]{64}$"},"mode":{"const":"O-15-NONSCORING-PREFLIGHT"},"publication":{"type":"object"},"qualification_plan_sha256":{"pattern":"^[0-9a-f]{64}$"},"regime":{"const":"B"},"rungs":{"const":["PRIMARY_QWEN3_4B_FP8","FALLBACK_QWEN3_8B_FP8"]},"schema_version":{"const":"m4-model-preflight-request-v1"},"source_class":{"const":"PROPOSED"},"swap":{"type":"object"}},"required":["schema_version","date","regime","source_class","mode","ladder_manifest_sha256","qualification_plan_sha256","rungs","context_lengths","co_residency","swap","publication"],"title":"M4 model preflight request v1","type":"object","x-artifact-date":"2026-08-21","x-artifact-regime":"B","x-source-class":"PROPOSED"}
