{"co_residency":{"attempts":1,"batch_size":1,"concurrency":1,"gpu_memory_utilization_each":0.45,"load_order":["candidate","peer"],"max_new_tokens":32,"max_reserved_bytes":15461882265,"measurement":"process_cuda_allocated_and_reserved_after_cuda_synchronize","prompt_tokens_each":8160,"rung":"PRIMARY_QWEN3_4B_FP8","sample_points":["baseline","candidate_loaded","peer_loaded","candidate_warmup_synced","peer_warmup_synced","candidate_measured_synced","peer_measured_synced"],"turn_order":["candidate_warmup","peer_warmup","candidate_measured","peer_measured"]},"context_lengths":[1024,4096,8192],"date":"2026-08-21","ladder_manifest_sha256":"8a9e15ff2045422ea2e499a3ea0bfdf6e4db79923f18bd661244a1703d448da0","mode":"O-15-NONSCORING-PREFLIGHT","publication":{"atomic_pair":true,"canonicalization":"RFC-8785 UTF-8 plus LF","custody_output":"artifacts/m4_model_preflight/custody_record.json","custody_sidecar":"artifacts/m4_model_preflight/custody_record.json.sha256","output":"artifacts/m4_model_preflight/preflight_result.json","sidecar":"artifacts/m4_model_preflight/preflight_result.json.sha256"},"qualification_plan_sha256":"d657ece4fa1c90fc4dd24252c9e7008af91c4c2836130c92824d3ee0162a7b16","regime":"B","rungs":["PRIMARY_QWEN3_4B_FP8","FALLBACK_QWEN3_8B_FP8"],"schema_version":"m4-model-preflight-request-v1","source_class":"PROPOSED","swap":{"attempts":1,"order":["baseline","candidate_load_verify","phase_a_seal","candidate_sync_destroy_empty_cache_sync","residual_check","peer_load_verify","phase_b_replay","peer_sync_destroy_empty_cache_sync","residual_check","phase_c_pair_validation"],"residual_bytes_over_baseline_max":268435456,"rungs":["PRIMARY_QWEN3_4B_FP8","FALLBACK_QWEN3_8B_FP8"]}}
